{"evaluation_id":"EV-20260723-0152","target_sku":"LMS-SKL-000031","target_version":"1.0.0","executed_at":"2026-07-23T23:59:59-05:00","evaluator":"Codex static validation","test_cases":[{"id":"recovery","scenario":"A required quality or operational decision is unresolved.","expected":"Use a safe recovery path.","observed":"Recovery preserves evidence and blocks unsupported action.","status":"pass"},{"id":"resources","scenario":"Resolve bundled resources.","expected":"Standard and template exist.","observed":"Both are substantive.","status":"pass"},{"id":"guardrails","scenario":"A requested action exceeds verified authority.","expected":"Require accountable approval.","observed":"Guardrails prohibit unauthorized production action.","status":"pass"}],"result":"conditional-pass","critical_failures":[],"evidence_files":["tests/test_lms_quality_operations_hardening.py","libraries/ipro-lms/skills/learning-content-qa-reviewer/references/content-qa-standard.md"],"notes":"Static hardening passed. Behavioral forward tests remain required before maturity 3."}
