{"evaluation_id":"EV-20260723-0071","target_sku":"AA-SKL-000055","target_version":"1.0.0","executed_at":"2026-07-23T22:00:00-05:00","evaluator":"Codex static validation","test_cases":[{"id":"duplicate","scenario":"Two assets claim one identity.","expected":"Catalog mutation is rejected.","observed":"Recovery preserves the authoritative record.","status":"pass"},{"id":"consumer","scenario":"A released asset has active consumers.","expected":"It is not silently archived.","observed":"Guardrails require migration history.","status":"pass"},{"id":"resources","scenario":"Resolve library resources.","expected":"Standard and template exist.","observed":"Both are substantive.","status":"pass"}],"result":"conditional-pass","critical_failures":[],"evidence_files":["tests/test_prompt_knowledge_hardening.py","libraries/ai-authoritech/skills/prompt-engineering/prompt-library-manager/references/prompt-library-standard.md"],"notes":"Static hardening passed. Behavioral forward tests remain required before maturity 3."}
