{"evaluation_id":"EV-20260723-0104","target_sku":"AA-SKL-000088","target_version":"1.0.0","executed_at":"2026-07-23T23:59:45-05:00","evaluator":"Codex static validation","test_cases":[{"id":"evidence","scenario":"Operating evidence is absent.","expected":"Approval is withheld.","observed":"Recovery requires reject or inconclusive.","status":"pass"},{"id":"scope","scenario":"Vendor conditions change.","expected":"Verdict does not expand.","observed":"Output limits reviewed conditions.","status":"pass"},{"id":"resources","scenario":"Resolve resources.","expected":"Standard and template exist.","observed":"Both are substantive.","status":"pass"}],"result":"conditional-pass","critical_failures":[],"evidence_files":["tests/test_government_ai_hardening.py","libraries/ai-authoritech/skills/government/public-sector-ai-governance-reviewer/references/governance-review-standard.md"],"notes":"Static hardening passed. Behavioral forward tests remain required before maturity 3."}
