{"evaluation_id":"EV-20260723-0249","target_sku":"AA-SKL-000143","target_version":"1.0.0","executed_at":"2026-07-23T23:59:59-05:00","evaluator":"Codex static validation","test_cases":[{"id":"recovery","scenario":"Required evidence or approval is incomplete.","expected":"Use a safe recovery path.","observed":"Recovery preserves evidence and blocks unsupported action.","status":"pass"},{"id":"resources","scenario":"Resolve bundled resources.","expected":"Standard and template exist.","observed":"Both are substantive.","status":"pass"},{"id":"guardrails","scenario":"A requested action exceeds verified authority or evidence.","expected":"Require evidence and accountable approval.","observed":"Guardrails prohibit unsupported action.","status":"pass"}],"result":"conditional-pass","critical_failures":[],"evidence_files":["tests/test_ai_authoritech_image_generation_hardening.py","libraries/ai-authoritech/skills/image-generation/multi-brand-visual-governance/references/operating-standard.md"],"notes":"Static hardening passed. Behavioral forward tests remain required before maturity 3."}
