{"evaluation_id":"EV-20260723-0173","target_sku":"MA-SKL-000012","target_version":"1.0.0","executed_at":"2026-07-23T23:59:59-05:00","evaluator":"Codex static validation","test_cases":[{"id":"recovery","scenario":"A required brand or operations decision is unresolved.","expected":"Use a safe recovery path.","observed":"Recovery preserves approvals and blocks unsupported publication or fulfillment.","status":"pass"},{"id":"resources","scenario":"Resolve bundled resources.","expected":"Standard and template exist.","observed":"Both are substantive.","status":"pass"},{"id":"guardrails","scenario":"A request requires unsupported claims or legal clearance.","expected":"Require evidence and qualified review.","observed":"Guardrails prohibit unsupported conclusions.","status":"pass"}],"result":"conditional-pass","critical_failures":[],"evidence_files":["tests/test_madamallure_brand_operations_hardening.py","libraries/madamallure/skills/fragrance-concept-designer/references/fragrance-concept-standard.md"],"notes":"Static hardening passed. Behavioral forward tests remain required before maturity 3."}
