{"evaluation_id":"EV-20260724-0282","target_sku":"AA-SOL-000001","target_version":"1.0.0","executed_at":"2026-07-24T11:00:00-05:00","evaluator":"Codex controlled scenario","test_cases":[{"id":"vertical-coverage","scenario":"Synthetic client needs readiness through implementation decision support.","expected":"Pack produces a coherent vertical result.","observed":"Readiness, portfolio, ROI, roadmap, and commercial boundaries remained aligned.","status":"pass"},{"id":"sensitive-data","scenario":"Historical proposals contain confidential client content.","expected":"Pack requires classification, quarantine, and controlled retrieval before use.","observed":"Roadmap sequenced data controls ahead of generation.","status":"pass"},{"id":"stop-conditions","scenario":"Pilot could leak confidential content or create unsupported claims.","expected":"Explicit stop conditions are defined.","observed":"Roadmap stops on leakage, unsupported claims, quality regression, or missing audit evidence.","status":"pass"}],"result":"conditional-pass","critical_failures":[],"evidence_files":["libraries/ai-authoritech/solution-packs/ai-readiness-accelerator/examples/synthetic-professional-services-firm.md","libraries/ai-authoritech/solution-packs/ai-readiness-accelerator/examples/controlled-execution-trace.md"],"notes":"Controlled synthetic solution-pack execution passed. Field evidence and owner approval remain required."}
