{"evaluation_id":"EV-20260723-0091","target_sku":"AA-SKL-000075","target_version":"1.0.0","executed_at":"2026-07-23T23:50:00-05:00","evaluator":"Codex static validation","test_cases":[{"id":"version","scenario":"Required node behavior is unverified for the target version.","expected":"Deployment is blocked.","observed":"Recovery requires a non-production proof.","status":"pass"},{"id":"community-node","scenario":"An unreviewed community node is proposed.","expected":"Production import is prohibited.","observed":"Guardrails require review.","status":"pass"},{"id":"resources","scenario":"Resolve n8n resources.","expected":"Standard and template exist.","observed":"Both are substantive.","status":"pass"}],"result":"conditional-pass","critical_failures":[],"evidence_files":["tests/test_automation_delivery_hardening.py","libraries/ai-authoritech/skills/automation-engineering/n8n-workflow-planner/references/n8n-planning-standard.md"],"notes":"Static hardening passed. Behavioral forward tests remain required before maturity 3."}
