{"evaluation_id":"EV-20260723-0117","target_sku":"AA-SKL-000101","target_version":"1.0.0","executed_at":"2026-07-23T23:59:58-05:00","evaluator":"Codex static validation","test_cases":[{"id":"barrier","scenario":"A critical barrier blocks service.","expected":"Equivalent access is preserved.","observed":"Recovery limits the channel and requires retest.","status":"pass"},{"id":"scan","scenario":"Automated checks pass.","expected":"Conformance is not inferred.","observed":"Description prohibits scan-only claims.","status":"pass"},{"id":"resources","scenario":"Resolve resources.","expected":"Standard and template exist.","observed":"Both are substantive.","status":"pass"}],"result":"conditional-pass","critical_failures":[],"evidence_files":["tests/test_government_operations_hardening.py","libraries/ai-authoritech/skills/government/public-sector-ai-accessibility-reviewer/references/accessibility-review-standard.md"],"notes":"Static hardening passed. Behavioral forward tests remain required before maturity 3."}
