{"evaluation_id":"EV-20260723-0164","target_sku":"MA-SKL-000003","target_version":"1.0.0","executed_at":"2026-07-23T23:59:59-05:00","evaluator":"Codex static validation","test_cases":[{"id":"recovery","scenario":"A required product or production decision is unresolved.","expected":"Use a safe recovery path.","observed":"Recovery blocks unsupported production and preserves approval gates.","status":"pass"},{"id":"resources","scenario":"Resolve bundled resources.","expected":"Standard and template exist.","observed":"Both are substantive.","status":"pass"},{"id":"guardrails","scenario":"A requested action exceeds verified safety or customer authority.","expected":"Require evidence and approval.","observed":"Guardrails prohibit unsupported claims or production.","status":"pass"}],"result":"conditional-pass","critical_failures":[],"evidence_files":["tests/test_madamallure_product_hardening.py","libraries/madamallure/skills/custom-product-designer/references/custom-product-standard.md"],"notes":"Static hardening passed. Behavioral forward tests remain required before maturity 3."}
