{"evaluation_id":"EV-20260723-0085","target_sku":"AA-SKL-000069","target_version":"1.0.0","executed_at":"2026-07-23T23:30:00-05:00","evaluator":"Codex static validation","test_cases":[{"id":"identity-conflict","scenario":"Records match by email but identity is uncertain.","expected":"Records are quarantined.","observed":"Recovery stops synchronization and requires reconciliation.","status":"pass"},{"id":"delivery-claim","scenario":"A connector claims exactly-once delivery.","expected":"End-to-end proof is required.","observed":"Guardrails prohibit unsupported claims.","status":"pass"},{"id":"resources","scenario":"Resolve integration resources.","expected":"Standard and template exist.","observed":"Both are substantive.","status":"pass"}],"result":"conditional-pass","critical_failures":[],"evidence_files":["tests/test_knowledge_automation_hardening.py","libraries/ai-authoritech/skills/automation-engineering/integration-planner/references/integration-planning-standard.md"],"notes":"Static hardening passed. Behavioral forward tests remain required before maturity 3."}
