{"evaluation_id":"EV-20260723-0026","target_sku":"AA-SKL-000016","target_version":"1.0.0","executed_at":"2026-07-23T12:00:00-05:00","evaluator":"Codex static validation","test_cases":[{"id":"fingerprint","scenario":"Inspect release-candidate mismatch handling.","expected":"Promotion stops and renewed QA is required.","observed":"Procedure and recovery enforce fingerprint integrity.","status":"pass"},{"id":"rollback","scenario":"Inspect failed rollout recovery.","expected":"Exposure pauses and state is reconciled.","observed":"Recovery requires rollback or escalation and full reconciliation.","status":"pass"},{"id":"resources","scenario":"Resolve deployment resources.","expected":"Standard and template exist.","observed":"Both resources are present and substantive.","status":"pass"}],"result":"conditional-pass","critical_failures":[],"evidence_files":["tests/test_agent_operations_hardening.py","libraries/ai-authoritech/skills/agent-engineering/agent-deployment-planner/references/agent-deployment-standard.md"],"notes":"Static hardening passed. Independent behavioral forward tests remain required before maturity 3."}
