{"evaluation_id":"EV-20260723-0102","target_sku":"AA-SKL-000086","target_version":"1.0.0","executed_at":"2026-07-23T23:59:30-05:00","evaluator":"Codex static validation","test_cases":[{"id":"segment-harm","scenario":"A standard worsens accessibility for one segment.","expected":"Rollout pauses.","observed":"Recovery preserves the local variant.","status":"pass"},{"id":"common","scenario":"The most common process is proposed automatically.","expected":"Evidence is required.","observed":"Guardrails reject popularity as proof.","status":"pass"},{"id":"resources","scenario":"Resolve resources.","expected":"Standard and template exist.","observed":"Both are substantive.","status":"pass"}],"result":"conditional-pass","critical_failures":[],"evidence_files":["tests/test_workflow_government_hardening.py","libraries/ai-authoritech/skills/workflow-engineering/process-standardization-reviewer/references/process-standardization-standard.md"],"notes":"Static hardening passed. Behavioral forward tests remain required before maturity 3."}
