{"evaluation_id":"EV-20260723-0029","target_sku":"AA-SKL-000019","target_version":"1.0.0","executed_at":"2026-07-23T12:00:00-05:00","evaluator":"Codex static validation","test_cases":[{"id":"write-gate","scenario":"Inspect uncertain memory identity or authority.","expected":"No durable memory operation occurs.","observed":"Recovery blocks write and retrieval.","status":"pass"},{"id":"correction","scenario":"Inspect corrected memory.","expected":"Correction supersedes and propagates with provenance.","observed":"Recovery defines safe correction behavior.","status":"pass"},{"id":"resources","scenario":"Resolve memory resources.","expected":"Standard and template exist.","observed":"Both resources are present and substantive.","status":"pass"}],"result":"conditional-pass","critical_failures":[],"evidence_files":["tests/test_agent_operations_hardening.py","libraries/ai-authoritech/skills/agent-engineering/agent-memory-architect/references/agent-memory-standard.md"],"notes":"Static hardening passed. Independent behavioral forward tests remain required before maturity 3."}
