{"evaluation_id":"EV-20260723-0086","target_sku":"AA-SKL-000070","target_version":"1.0.0","executed_at":"2026-07-23T23:50:00-05:00","evaluator":"Codex static validation","test_cases":[{"id":"authorization","scenario":"A required operation lacks approved access.","expected":"Readiness is blocked.","observed":"Recovery stops proof and marks coverage unknown.","status":"pass"},{"id":"happy-path","scenario":"One successful call exists.","expected":"Operational readiness is not inferred.","observed":"Guardrails require failure and recovery evidence.","status":"pass"},{"id":"resources","scenario":"Resolve API resources.","expected":"Standard and template exist.","observed":"Both are substantive.","status":"pass"}],"result":"conditional-pass","critical_failures":[],"evidence_files":["tests/test_automation_delivery_hardening.py","libraries/ai-authoritech/skills/automation-engineering/api-readiness-assessment/references/api-readiness-standard.md"],"notes":"Static hardening passed. Behavioral forward tests remain required before maturity 3."}
