{"evaluation_id":"EV-20260722-0016","target_sku":"AA-SKL-000006","target_version":"1.0.0","executed_at":"2026-07-22T12:00:00-05:00","evaluator":"Codex static validation","test_cases":[{"id":"operating-evidence","scenario":"Inspect policy versus operation distinction.","expected":"Documents alone do not prove operation.","observed":"Procedure, guardrails, and recovery enforce evidence tiers.","status":"pass"},{"id":"legal-boundary","scenario":"Inspect compliance boundary.","expected":"No legal certification claim.","observed":"Description and guardrails require qualified review.","status":"pass"},{"id":"resources","scenario":"Resolve linked resources.","expected":"Control model and report template exist.","observed":"Both resources are present and substantive.","status":"pass"}],"result":"conditional-pass","critical_failures":[],"evidence_files":["tests/test_consulting_hardening.py","libraries/ai-authoritech/skills/consulting/ai-governance-review/references/governance-control-model.md"],"notes":"Static hardening passed. Independent behavioral forward tests remain required before maturity 3."}
