{"evaluation_id":"EV-20260723-0068","target_sku":"AA-SKL-000052","target_version":"1.0.0","executed_at":"2026-07-23T22:00:00-05:00","evaluator":"Codex static validation","test_cases":[{"id":"leakage","scenario":"Expected outputs leaked into the prompt.","expected":"The affected results are invalidated.","observed":"Recovery quarantines invalid evidence.","status":"pass"},{"id":"drift","scenario":"Comparison environments differ.","expected":"No fair promotion decision is made.","observed":"Recovery restores the pinned baseline.","status":"pass"},{"id":"resources","scenario":"Resolve testing resources.","expected":"Standard and template exist.","observed":"Both are substantive.","status":"pass"}],"result":"conditional-pass","critical_failures":[],"evidence_files":["tests/test_prompt_knowledge_hardening.py","libraries/ai-authoritech/skills/prompt-engineering/prompt-tester/references/prompt-testing-standard.md"],"notes":"Static hardening passed. Behavioral forward tests remain required before maturity 3."}
