{"evaluation_id":"EV-20260723-0089","target_sku":"AA-SKL-000073","target_version":"1.0.0","executed_at":"2026-07-23T23:50:00-05:00","evaluator":"Codex static validation","test_cases":[{"id":"missing-evidence","scenario":"A high-value opportunity lacks readiness evidence.","expected":"It is removed from automatic ranking.","observed":"Recovery classifies it research or prepare.","status":"pass"},{"id":"hard-gate","scenario":"Privacy authorization fails.","expected":"Weighted value cannot override the gate.","observed":"Guardrails preserve critical blockers.","status":"pass"},{"id":"resources","scenario":"Resolve prioritization resources.","expected":"Standard and template exist.","observed":"Both are substantive.","status":"pass"}],"result":"conditional-pass","critical_failures":[],"evidence_files":["tests/test_automation_delivery_hardening.py","libraries/ai-authoritech/skills/automation-engineering/automation-prioritization-matrix/references/automation-prioritization-standard.md"],"notes":"Static hardening passed. Behavioral forward tests remain required before maturity 3."}
